{
  "schemaVersion": 1,
  "delegationId": "D-1",
  "workId": "EXAMPLE-1",
  "workRevision": 1,
  "agent": "sol-planner",
  "status": "blocked",
  "summary": "Falta la decisión de alcance indicada en questions.",
  "artifacts": [],
  "changedFiles": [],
  "checks": [],
  "findings": [],
  "questions": [
    "¿Cuál es el comportamiento esperado para el caso inválido?"
  ],
  "limitations": [
    "No se ejecutaron pruebas."
  ],
  "suggestedNextStep": "Sol debe resolver la decisión con el usuario."
}
